{
  "$schema": "https://json-schema.org/draft/2020-12/schema",
  "$id": "https://local.harness/policy.schema.json",
  "title": "Repo-Owned Solidity Harness Policy",
  "type": "object",
  "additionalProperties": false,
  "required": [
    "version",
    "repo",
    "surfaces",
    "write_roles",
    "risk_rules",
    "orchestration_review_roles",
    "delegated_review_rules",
    "full_review_matrix",
    "orchestration_rules",
    "verification_profiles",
    "hard_blocks",
    "testing_gaps",
    "test_mapping"
  ],
  "not": {
    "anyOf": [
      { "required": ["review_matrix"] },
      { "required": ["review_triggers"] }
    ]
  },
  "properties": {
    "version": { "type": "integer", "minimum": 1 },
    "repo": { "type": "string", "minLength": 1 },
    "changed_file_modes": {
      "type": "object",
      "propertyNames": { "type": "string", "minLength": 1 },
      "additionalProperties": {
        "type": "string",
        "enum": ["added", "copied", "modified", "renamed", "deleted", "type-changed", "unmerged", "unknown"]
      }
    },
    "surfaces": { "$ref": "#/$defs/surfacePatternsMap" },
    "write_roles": { "$ref": "#/$defs/surfaceOwnerMap" },
    "risk_rules": {
      "type": "object",
      "properties": {
        "slither_filter_paths": { "type": "string" },
        "slither_exclude_detectors": { "type": "string" }
      },
      "additionalProperties": false
    },
    "orchestration_review_roles": {
      "type": "object",
      "required": ["no-op", "non-semantic", "test-semantic", "prod-semantic-risk-analysis-passed"],
      "properties": {
        "no-op": { "$ref": "#/$defs/reviewRoleArray" },
        "non-semantic": { "$ref": "#/$defs/reviewRoleArray" },
        "test-semantic": { "$ref": "#/$defs/reviewRoleArray" },
        "prod-semantic-risk-analysis-passed": { "$ref": "#/$defs/reviewRoleArray" }
      },
      "additionalProperties": false
    },
    "delegated_review_rules": {
      "type": "array",
      "items": { "$ref": "#/$defs/delegatedReviewRule" },
      "uniqueItems": true
    },
    "full_review_matrix": {
      "type": "object",
      "required": ["no-op", "non-semantic", "test-semantic", "prod-semantic"],
      "properties": {
        "no-op": { "$ref": "#/$defs/reviewRoleArray" },
        "non-semantic": { "$ref": "#/$defs/reviewRoleArray" },
        "test-semantic": { "$ref": "#/$defs/reviewRoleArray" },
        "prod-semantic": { "$ref": "#/$defs/reviewRoleArray" }
      },
      "additionalProperties": false
    },
    "orchestration_rules": { "$ref": "#/$defs/orchestrationRules" },
    "verification_profiles": {
      "type": "object",
      "required": ["fast", "full", "ci"],
      "properties": {
        "fast": { "$ref": "#/$defs/fastVerificationProfile" },
        "full": { "$ref": "#/$defs/fullVerificationProfile" },
        "ci": { "$ref": "#/$defs/ciVerificationProfile" }
      },
      "additionalProperties": false
    },
    "hard_blocks": {
      "type": "array",
      "items": { "$ref": "#/$defs/blockRule" },
      "uniqueItems": true
    },
    "testing_gaps": {
      "type": "object",
      "propertyNames": { "type": "string", "minLength": 1 },
      "additionalProperties": {
        "type": "array",
        "items": { "$ref": "#/$defs/testingGap" },
        "uniqueItems": true
      }
    },
    "test_mapping": {
      "type": "object",
      "minProperties": 1,
      "propertyNames": { "type": "string", "minLength": 1 },
      "additionalProperties": { "$ref": "#/$defs/testMappingEntry" }
    }
  },
  "$defs": {
    "surfaceName": {
      "type": "string",
      "enum": ["solidity_prod", "solidity_test", "harness_control"]
    },
    "surfaceNameArray": {
      "type": "array",
      "items": { "$ref": "#/$defs/surfaceName" },
      "minItems": 1,
      "uniqueItems": true
    },
    "surfaceSet": {
      "type": "array",
      "items": { "$ref": "#/$defs/surfaceName" },
      "minItems": 2,
      "uniqueItems": true
    },
    "surfacePatternsMap": {
      "type": "object",
      "required": ["solidity_prod", "solidity_test", "harness_control"],
      "properties": {
        "solidity_prod": { "$ref": "#/$defs/stringArray" },
        "solidity_test": { "$ref": "#/$defs/stringArray" },
        "harness_control": { "$ref": "#/$defs/stringArray" }
      },
      "additionalProperties": false
    },
    "surfaceOwnerMap": {
      "type": "object",
      "required": ["solidity_prod", "solidity_test", "harness_control"],
      "properties": {
        "solidity_prod": { "$ref": "#/$defs/writeRoleName" },
        "solidity_test": { "$ref": "#/$defs/writeRoleName" },
        "harness_control": { "$ref": "#/$defs/writeRoleName" }
      },
      "additionalProperties": false
    },
    "stringArray": {
      "type": "array",
      "items": { "type": "string", "minLength": 1 },
      "minItems": 1,
      "uniqueItems": true
    },
    "writeRoleName": {
      "type": "string",
      "enum": ["solidity-implementer", "process-implementer"]
    },
    "reviewRoleName": {
      "type": "string",
      "enum": ["spec-reviewer", "logic-reviewer", "security-reviewer", "gas-reviewer"]
    },
    "reviewRoleArray": {
      "type": "array",
      "items": { "$ref": "#/$defs/reviewRoleName" },
      "uniqueItems": true
    },
    "delegatedReviewRule": {
      "type": "object",
      "required": ["id", "paths", "reviewers", "requires_human_confirmation"],
      "properties": {
        "id": { "type": "string", "minLength": 1 },
        "paths": { "$ref": "#/$defs/stringArray" },
        "exclude_paths": { "$ref": "#/$defs/stringArray" },
        "reviewers": { "$ref": "#/$defs/reviewRoleArray" },
        "requires_human_confirmation": { "type": "boolean" }
      },
      "additionalProperties": false
    },
    "orchestrationRules": {
      "type": "object",
      "required": ["spec_paths", "scope_escalation", "surface_sensitivity"],
      "properties": {
        "spec_paths": { "$ref": "#/$defs/stringArray" },
        "doc_round": {
          "type": "object",
          "required": ["trigger_change_class", "writer_role"],
          "properties": {
            "trigger_change_class": {
              "type": "array",
              "items": { "type": "string" },
              "minItems": 1
            },
            "writer_role": { "type": "string", "minLength": 1 }
          },
          "additionalProperties": false
        },
        "scope_escalation": {
          "type": "object",
          "required": ["prod_solidity_max_files_before_full_review", "prod_solidity_max_semantic_lines_before_full_review"],
          "properties": {
            "prod_solidity_max_files_before_full_review": { "type": "integer", "minimum": 1 },
            "prod_solidity_max_semantic_lines_before_full_review": { "type": "integer", "minimum": 1 }
          },
          "additionalProperties": false
        },
        "surface_sensitivity": {
          "type": "object",
          "required": ["solidity_prod", "solidity_test", "harness_control"],
          "properties": {
            "solidity_prod": { "const": "sensitive" },
            "solidity_test": { "const": "normal" },
            "harness_control": { "const": "normal" }
          },
          "additionalProperties": false
        }
      },
      "additionalProperties": false
    },
    "commandId": {
      "type": "string",
      "enum": [
        "fmt_changed_solidity",
        "lint_changed_solidity",
        "forge_build",
        "targeted_tests",
        "forge_test_full",
        "coverage_when_required",
        "slither_when_required",
        "bash_syntax_changed_shell",
        "node_syntax_changed_js",
        "npm_ci_when_package_changes"
      ]
    },
    "commandIdArray": {
      "type": "array",
      "items": { "$ref": "#/$defs/commandId" },
      "minItems": 1,
      "uniqueItems": true
    },
    "fastRequiredCommands": {
      "type": "array",
      "items": { "$ref": "#/$defs/commandId" },
      "minItems": 7,
      "maxItems": 7,
      "uniqueItems": true,
      "allOf": [
        { "contains": { "const": "fmt_changed_solidity" } },
        { "contains": { "const": "lint_changed_solidity" } },
        { "contains": { "const": "forge_build" } },
        { "contains": { "const": "targeted_tests" } },
        { "contains": { "const": "bash_syntax_changed_shell" } },
        { "contains": { "const": "node_syntax_changed_js" } },
        { "contains": { "const": "npm_ci_when_package_changes" } }
      ]
    },
    "fullRequiredCommands": {
      "type": "array",
      "items": { "$ref": "#/$defs/commandId" },
      "minItems": 9,
      "maxItems": 9,
      "uniqueItems": true,
      "allOf": [
        { "contains": { "const": "fmt_changed_solidity" } },
        { "contains": { "const": "lint_changed_solidity" } },
        { "contains": { "const": "forge_build" } },
        { "contains": { "const": "forge_test_full" } },
        { "contains": { "const": "coverage_when_required" } },
        { "contains": { "const": "slither_when_required" } },
        { "contains": { "const": "bash_syntax_changed_shell" } },
        { "contains": { "const": "node_syntax_changed_js" } },
        { "contains": { "const": "npm_ci_when_package_changes" } }
      ]
    },
    "verificationProfileBase": {
      "type": "object",
      "required": ["required_commands"],
      "properties": {},
      "additionalProperties": true
    },
    "fastVerificationProfile": {
      "allOf": [
        { "$ref": "#/$defs/verificationProfileBase" },
        { "properties": { "required_commands": { "$ref": "#/$defs/fastRequiredCommands" } } }
      ]
    },
    "fullVerificationProfile": {
      "allOf": [
        { "$ref": "#/$defs/verificationProfileBase" },
        { "properties": { "required_commands": { "$ref": "#/$defs/fullRequiredCommands" } } }
      ]
    },
    "ciVerificationProfile": {
      "allOf": [
        { "$ref": "#/$defs/verificationProfileBase" },
        { "properties": { "required_commands": { "$ref": "#/$defs/fullRequiredCommands" } } }
      ]
    },
    "blockRule": {
      "type": "object",
      "required": ["id", "message"],
      "properties": {
        "id": { "type": "string", "minLength": 1 },
        "message": { "type": "string", "minLength": 1 },
        "paths": { "$ref": "#/$defs/stringArray" },
        "tokens": { "$ref": "#/$defs/stringArray" },
        "commands": { "$ref": "#/$defs/commandIdArray" },
        "surfaces": { "$ref": "#/$defs/surfaceNameArray" },
        "writer_roles": {
          "type": "array",
          "items": { "$ref": "#/$defs/writeRoleName" },
          "minItems": 1,
          "uniqueItems": true
        },
        "mixed_surface_sets": {
          "type": "array",
          "items": { "$ref": "#/$defs/surfaceSet" },
          "minItems": 1,
          "uniqueItems": true
        },
        "legacy_roots": { "type": "boolean" }
      },
      "additionalProperties": false,
      "anyOf": [
        { "required": ["paths"] },
        { "required": ["tokens"] },
        { "required": ["commands"] },
        { "required": ["surfaces"] },
        { "required": ["writer_roles"] },
        { "required": ["mixed_surface_sets"] },
        { "required": ["legacy_roots"] }
      ]
    },
    "testingGap": {
      "type": "object",
      "required": ["id", "paths", "status", "enforcement"],
      "properties": {
        "id": { "type": "string", "minLength": 1 },
        "paths": { "$ref": "#/$defs/stringArray" },
        "status": { "type": "string", "minLength": 1 },
        "enforcement": { "type": "string", "enum": ["residual-risk", "full-review"] }
      },
      "additionalProperties": false
    },
    "mappedRule": {
      "type": "object",
      "required": ["id", "paths", "change_tests", "evidence_tests"],
      "properties": {
        "id": { "type": "string", "minLength": 1 },
        "paths": { "$ref": "#/$defs/stringArray" },
        "change_tests": { "$ref": "#/$defs/stringArray" },
        "evidence_tests": { "$ref": "#/$defs/stringArray" }
      },
      "additionalProperties": false
    },
    "testMappingEntry": {
      "type": "object",
      "properties": {
        "tests": { "$ref": "#/$defs/stringArray" },
        "rules": {
          "type": "array",
          "items": { "$ref": "#/$defs/mappedRule" },
          "minItems": 1,
          "uniqueItems": true
        }
      },
      "additionalProperties": false,
      "anyOf": [{ "required": ["tests"] }, { "required": ["rules"] }]
    }
  }
}
