{
  "delegated_review_rules": [
    {
      "id": "harness-control",
      "paths": [
        "^\\.harness/.*$",
        "^script/harness/.*$",
        "^\\.github/workflows/.*$"
      ],
      "requires_human_confirmation": false,
      "reviewers": []
    },
    {
      "exclude_paths": [
        "(^|.*/)(spec|specs)/.*\\.(md|mdx)$"
      ],
      "id": "non-spec-doc",
      "paths": [
        "^docs/.*$"
      ],
      "requires_human_confirmation": false,
      "reviewers": []
    }
  ],
  "full_review_matrix": {
    "no-op": [],
    "non-semantic": [],
    "prod-semantic": [
      "logic-reviewer",
      "security-reviewer",
      "gas-reviewer"
    ],
    "test-semantic": [
      "logic-reviewer"
    ]
  },
  "hard_blocks": [],
  "orchestration_review_roles": {
    "no-op": [],
    "non-semantic": [],
    "prod-semantic-risk-analysis-passed": [
      "logic-reviewer"
    ],
    "test-semantic": [
      "logic-reviewer"
    ]
  },
  "orchestration_rules": {
    "scope_escalation": {
      "prod_solidity_max_files_before_full_review": 1,
      "prod_solidity_max_semantic_lines_before_full_review": 20
    },
    "spec_paths": [
      "(^|.*/)(spec|specs)/.*\\.(md|mdx)$"
    ],
    "surface_sensitivity": {
      "harness_control": "normal",
      "solidity_prod": "sensitive",
      "solidity_test": "normal"
    }
  },
  "repo": "MemeverseV2",
  "risk_rules": {
    "slither_exclude_detectors": "naming-convention,too-many-digits,unindexed-event-address,immutable-states,unimplemented-functions",
    "slither_filter_paths": "lib|test|script|node_modules"
  },
  "surfaces": {
    "harness_control": [
      "(^|.*/)(spec|specs)/.*\\.(md|mdx)$",
      "^AGENTS\\.md$",
      "^CLAUDE\\.md$",
      "^README\\.md$",
      "^\\.claude/agents/.*$",
      "^\\.claude/settings\\.json$",
      "^\\.codex/agents/.*$",
      "^\\.githooks/.*$",
      "^\\.github/pull_request_template\\.md$",
      "^\\.github/workflows/.*$",
      "^\\.github/workflows/pr-template-check\\.yml$",
      "^\\.gitmodules$",
      "^\\.gitignore$",
      "^\\.harness/policy\\.json$",
      "^\\.harness/runtime/main-session-contract\\.md$",
      "^\\.harness/schemas/.*$",
      "^docs/.*$",
      "^foundry\\.toml$",
      "^lib/LayerZero-v2$",
      "^lib/devtools$",
      "^lib/flexible-voting$",
      "^lib/forge-std$",
      "^lib/openzeppelin-contracts-upgradeable$",
      "^lib/openzeppelin-foundry-upgrades$",
      "^lib/solidity-bytes-utils$",
      "^lib/solmate$",
      "^lib/v4-core$",
      "^lib/v4-hooks-public$",
      "^lib/v4-periphery$",
      "^npm-shrinkwrap\\.json$",
      "^package-lock\\.json$",
      "^package\\.json$",
      "^remappings\\.txt$",
      "^script/harness/.*$",
      "^solhint.*\\.config\\.js$"
    ],
    "solidity_prod": [
      "^src/.*\\.sol$",
      "^script/.*\\.sol$"
    ],
    "solidity_test": [
      "^test/.*\\.sol$"
    ]
  },
  "test_mapping": {
    "memeverse": {
      "rules": [
        {
          "change_tests": [
            "test/swap/MemeverseSwapRouter.t.sol",
            "test/swap/MemeverseSwapRouterPermit2.t.sol",
            "test/swap/MemeverseSwapRouterInterface.t.sol"
          ],
          "evidence_tests": [
            "test/swap/MemeverseSwapRouter.t.sol",
            "test/swap/MemeverseSwapRouterPermit2.t.sol",
            "test/swap/MemeverseSwapRouterInterface.t.sol"
          ],
          "id": "swap-router-core",
          "paths": [
            "src/swap/MemeverseSwapRouter.sol",
            "src/swap/interfaces/IMemeverseSwapRouter.sol"
          ]
        },
        {
          "change_tests": [
            "test/swap/MemeverseUniswapHookLiquidity.t.sol"
          ],
          "evidence_tests": [
            "test/swap/MemeverseUniswapHookLiquidity.t.sol",
            "test/swap/MemeverseSwapRouter.t.sol"
          ],
          "id": "swap-hook-liquidity",
          "paths": [
            "src/swap/libraries/MemeverseHookLib.sol",
            "src/swap/MemeverseUniswapHook.sol",
            "src/swap/libraries/LiquidityQuote.sol",
            "src/swap/tokens/UniswapLP.sol",
            "src/swap/interfaces/IMemeverseUniswapHook.sol"
          ]
        },
        {
          "change_tests": [
            "test/swap/MemeverseSwapRouter.t.sol",
            "test/swap/MemeverseSwapRouterPermit2.t.sol",
            "test/swap/MemeverseUniswapHookLiquidity.t.sol"
          ],
          "evidence_tests": [
            "test/swap/MemeverseSwapRouter.t.sol",
            "test/swap/MemeverseSwapRouterPermit2.t.sol",
            "test/swap/MemeverseUniswapHookLiquidity.t.sol",
            "test/swap/MemeverseDynamicFeeSimulation.t.sol"
          ],
          "id": "swap-liquidity-math",
          "paths": [
            "src/swap/libraries/LiquidityAmounts.sol"
          ]
        },
        {
          "change_tests": [
            "test/verse/MemeverseLauncherLifecycle.t.sol",
            "test/verse/MemeverseLauncherConfig.t.sol",
            "test/verse/MemeverseLauncherRegistration.t.sol",
            "test/verse/MemeverseLauncherViews.t.sol"
          ],
          "evidence_tests": [
            "test/verse/MemeverseLauncherLifecycle.t.sol",
            "test/verse/MemeverseLauncherConfig.t.sol",
            "test/verse/MemeverseLauncherRegistration.t.sol",
            "test/verse/MemeverseLauncherViews.t.sol"
          ],
          "id": "launcher-core",
          "paths": [
            "src/verse/MemeverseLauncher.sol",
            "src/verse/interfaces/IMemeverseLauncher.sol"
          ]
        },
        {
          "change_tests": [
            "test/verse/MemeverseLauncherLifecycle.t.sol",
            "test/verse/MemeverseLauncherAssetFlowInvariant.t.sol",
            "test/swap/MemeverseSwapRouter.t.sol",
            "test/swap/MemeverseUniswapHookLiquidity.t.sol"
          ],
          "evidence_tests": [
            "test/verse/MemeverseLauncherLifecycle.t.sol",
            "test/verse/MemeverseLauncherAssetFlowInvariant.t.sol",
            "test/swap/MemeverseSwapRouter.t.sol",
            "test/swap/MemeverseUniswapHookLiquidity.t.sol"
          ],
          "id": "unlock-protection-safety",
          "paths": [
            "src/verse/MemeverseLauncher.sol",
            "src/verse/interfaces/IMemeverseLauncher.sol",
            "src/swap/MemeverseSwapRouter.sol",
            "src/swap/interfaces/IMemeverseSwapRouter.sol",
            "src/swap/MemeverseUniswapHook.sol",
            "src/swap/interfaces/IMemeverseUniswapHook.sol"
          ]
        },
        {
          "change_tests": [
            "test/verse/libraries/InitialPriceCalculator.t.sol"
          ],
          "evidence_tests": [
            "test/verse/libraries/InitialPriceCalculator.t.sol"
          ],
          "id": "launcher-price-math",
          "paths": [
            "src/verse/libraries/InitialPriceCalculator.sol"
          ]
        },
        {
          "change_tests": [
            "test/verse/registration/MemeverseRegistrarAtLocal.t.sol",
            "test/verse/registration/MemeverseRegistrarOmnichain.t.sol",
            "test/verse/registration/MemeverseRegistrationCenter.t.sol"
          ],
          "evidence_tests": [
            "test/verse/registration/MemeverseRegistrarAtLocal.t.sol",
            "test/verse/registration/MemeverseRegistrarOmnichain.t.sol",
            "test/verse/registration/MemeverseRegistrationCenter.t.sol",
            "test/verse/MemeverseLauncherRegistration.t.sol"
          ],
          "id": "verse-registration-core",
          "paths": [
            "src/verse/registration/MemeverseRegistrarAbstract.sol",
            "src/verse/registration/MemeverseRegistrarAtLocal.sol",
            "src/verse/registration/MemeverseRegistrarOmnichain.sol",
            "src/verse/registration/MemeverseRegistrationCenter.sol",
            "src/verse/interfaces/IMemeverseRegistrar.sol",
            "src/verse/interfaces/IMemeverseRegistrarAtLocal.sol",
            "src/verse/interfaces/IMemeverseRegistrarOmnichain.sol",
            "src/verse/interfaces/IMemeverseRegistrationCenter.sol"
          ]
        },
        {
          "change_tests": [
            "test/verse/YieldDispatcher.t.sol",
            "test/verse/deployment/MemeverseProxyDeployer.t.sol"
          ],
          "evidence_tests": [
            "test/verse/YieldDispatcher.t.sol",
            "test/verse/deployment/MemeverseProxyDeployer.t.sol",
            "test/verse/MemeverseLauncherLifecycle.t.sol"
          ],
          "id": "verse-dispatch-and-deployment",
          "paths": [
            "src/verse/YieldDispatcher.sol",
            "src/verse/interfaces/IYieldDispatcher.sol",
            "src/verse/deployment/MemeverseProxyDeployer.sol",
            "src/verse/interfaces/IMemeverseProxyDeployer.sol"
          ]
        },
        {
          "change_tests": [
            "test/governance/GovernanceCycleIncentivizerUpgradeable.t.sol",
            "test/governance/MemecoinDaoGovernorUpgradeable.t.sol"
          ],
          "evidence_tests": [
            "test/governance/GovernanceCycleIncentivizerUpgradeable.t.sol",
            "test/governance/MemecoinDaoGovernorUpgradeable.t.sol"
          ],
          "id": "governance-core",
          "paths": [
            "src/governance/GovernanceCycleIncentivizerUpgradeable.sol",
            "src/governance/MemecoinDaoGovernorUpgradeable.sol",
            "src/governance/interfaces/IGovernanceCycleIncentivizer.sol",
            "src/governance/interfaces/IMemecoinDaoGovernor.sol"
          ]
        },
        {
          "change_tests": [
            "test/interoperation/MemeverseOmnichainInteroperation.t.sol",
            "test/interoperation/OmnichainMemecoinStaker.t.sol"
          ],
          "evidence_tests": [
            "test/interoperation/MemeverseOmnichainInteroperation.t.sol",
            "test/interoperation/OmnichainMemecoinStaker.t.sol"
          ],
          "id": "interoperation-core",
          "paths": [